{
  "$schema": "http://json-schema.org/draft-07/schema#",
  "$id": "https://trading-platform.io/schemas/smc_events.v1.schema.json",
  "title": "SMC Events V1",
  "description": "Smart Money Concepts events - Change of Character (CHOCH) and Break of Structure (BOS)",
  "type": "object",
  "properties": {
    "version": {
      "type": "string",
      "pattern": "^\\d+\\.\\d+\\.\\d+$",
      "description": "Schema version in semver format"
    },
    "venue": {
      "type": "string",
      "description": "Exchange/venue name",
      "examples": ["binance", "bybit", "okx"]
    },
    "symbol": {
      "type": "string",
      "description": "Trading pair symbol",
      "examples": ["BTCUSDT", "ETHUSDT"]
    },
    "timeframe": {
      "type": "string",
      "description": "Candle timeframe",
      "examples": ["1m", "5m", "15m", "1h", "4h", "1d"]
    },
    "event_time": {
      "type": "string",
      "format": "date-time",
      "pattern": "^\\d{4}-\\d{2}-\\d{2}T\\d{2}:\\d{2}:\\d{2}(\\.\\d{3})?Z$",
      "description": "Time when the event occurred"
    },
    "event_type": {
      "type": "string",
      "enum": ["choch", "bos"],
      "description": "Type of SMC event"
    },
    "direction": {
      "type": "string",
      "enum": ["bullish", "bearish"],
      "description": "Direction of the structure break"
    },
    "price_level": {
      "type": "number",
      "description": "Price at which the event occurred"
    },
    "previous_pivot_price": {
      "type": "number",
      "description": "Price of the previous pivot point"
    },
    "previous_pivot_time": {
      "type": "string",
      "format": "date-time",
      "pattern": "^\\d{4}-\\d{2}-\\d{2}T\\d{2}:\\d{2}:\\d{2}(\\.\\d{3})?Z$",
      "description": "Time of the previous pivot point"
    },
    "broken_pivot_price": {
      "type": "number",
      "description": "Price of the broken pivot point"
    },
    "broken_pivot_time": {
      "type": "string",
      "format": "date-time",
      "pattern": "^\\d{4}-\\d{2}-\\d{2}T\\d{2}:\\d{2}:\\d{2}(\\.\\d{3})?Z$",
      "description": "Time of the broken pivot point"
    }
  },
  "required": [
    "version",
    "venue",
    "symbol",
    "timeframe",
    "event_time",
    "event_type",
    "direction",
    "price_level",
    "previous_pivot_price",
    "previous_pivot_time",
    "broken_pivot_price",
    "broken_pivot_time"
  ],
  "additionalProperties": false
}